{
  "$schema": "https://json-schema.org/draft/2020-12/schema",
  "$id": "https://ardenfall-compendium.example/schemas/entity.schema.json",
  "title": "Entity descriptor",
  "type": "object",
  "additionalProperties": false,
  "required": ["id", "kind", "label", "extraction", "canonicalTable", "fields"],
  "properties": {
    "$schema": { "type": "string" },
    "id": { "type": "string", "pattern": "^[a-z][a-z0-9-]*$" },
    "kind": { "enum": ["definition", "instance"] },
    "label": {
      "type": "object",
      "additionalProperties": false,
      "required": ["singular", "plural"],
      "properties": {
        "singular": { "type": "string", "minLength": 1 },
        "plural": { "type": "string", "minLength": 1 }
      }
    },
    "extraction": {
      "type": "object",
      "additionalProperties": false,
      "required": ["source", "root", "file"],
      "properties": {
        "source": { "enum": ["lookupAsset", "record", "scene", "namedAsset"] },
        "root": { "type": "string", "minLength": 1 },
        "file": { "type": "string", "minLength": 1 },
        "walker": { "type": "string" },
        "options": { "type": "object" }
      }
    },
    "definition": {
      "description": "Optional for instances without a separate definition asset, such as portals.",
      "type": "object",
      "additionalProperties": false,
      "required": ["entity", "via"],
      "properties": {
        "entity": { "type": "string", "pattern": "^[a-z][a-z0-9-]*$" },
        "via": { "type": "string", "minLength": 1 }
      }
    },
    "placement": {
      "type": "object",
      "additionalProperties": false,
      "required": ["kind", "from"],
      "properties": {
        "kind": { "enum": ["point", "volume", "point+volume"] },
        "from": { "type": "string", "minLength": 1 }
      }
    },
    "presentationContext": {
      "type": "object",
      "additionalProperties": false,
      "required": ["renderContext"],
      "properties": {
        "renderContext": { "type": "string", "minLength": 1 }
      }
    },
    "naming": { "$ref": "#/$defs/naming" },
    "canonicalTable": { "type": "string", "pattern": "^[a-z][a-z0-9_]*$" },
    "fields": {
      "type": "array",
      "minItems": 1,
      "items": { "$ref": "#/$defs/field" }
    },
    "variants": {
      "type": "object",
      "additionalProperties": false,
      "required": ["dir"],
      "properties": {
        "dir": { "type": "string", "default": "variants" },
        "registry": { "type": "string" }
      }
    },
    "denormalise": {
      "type": "array",
      "items": { "$ref": "#/$defs/op" }
    },
    "site": {
      "type": "object",
      "additionalProperties": false,
      "required": ["route"],
      "properties": {
        "route": {
          "type": "string",
          "pattern": "^/$|^/[a-z0-9]+(?:-[a-z0-9]+)*(?:/[a-z0-9]+(?:-[a-z0-9]+)*)*$"
        },
        "previousRoutes": {
          "description": "Route bases that this entity family used before its current route.",
          "type": "array",
          "items": {
            "type": "string",
            "pattern": "^/$|^/[a-z0-9]+(?:-[a-z0-9]+)*(?:/[a-z0-9]+(?:-[a-z0-9]+)*)*$"
          },
          "uniqueItems": true
        },
        "overview": { "$ref": "#/$defs/siteOverview" },
        "detail": { "$ref": "#/$defs/siteDetail" }
      }
    },
    "map": {
      "oneOf": [{ "type": "null" }, { "$ref": "#/$defs/siteMap" }],
      "default": null
    }
  },
  "allOf": [
    {
      "if": {
        "required": ["kind"],
        "properties": { "kind": { "const": "definition" } }
      },
      "then": {
        "type": "object",
        "properties": {
          "definition": false,
          "placement": {
            "type": "object",
            "properties": {
              "from": { "not": { "const": "transform" } }
            }
          }
        }
      }
    }
  ],
  "$defs": {
    "naming": {
      "type": "object",
      "additionalProperties": false,
      "properties": {
        "displayName": { "$ref": "#/$defs/namingSource" },
        "authoringLabel": { "$ref": "#/$defs/namingSource" }
      }
    },
    "namingSource": {
      "type": "object",
      "additionalProperties": false,
      "required": ["from", "policy"],
      "properties": {
        "from": { "type": "string", "minLength": 1 },
        "policy": { "enum": ["player-visible", "designer-identifier"] }
      }
    },
    "field": {
      "type": "object",
      "additionalProperties": false,
      "required": ["name", "type", "from"],
      "properties": {
        "name": { "type": "string", "pattern": "^[a-z][a-zA-Z0-9_]*$" },
        "type": {
          "enum": [
            "id",
            "string",
            "integer",
            "number",
            "boolean",
            "json",
            "ref:asset",
            "ref:asset[]",
            "ref:record"
          ]
        },
        "from": { "type": "string", "minLength": 1 },
        "operation": { "type": "string" },
        "missingPolicy": {
          "enum": ["fatal", "diagnostic", "optional-empty"],
          "default": "diagnostic"
        },
        "storage": {
          "type": "string",
          "enum": ["column", "unstored"],
          "default": "column"
        },
        "column": { "type": "string", "pattern": "^[a-z][a-z0-9_]*$" },
        "projects": {
          "description": "Canonical table, or tables, this field expands into.",
          "oneOf": [
            { "type": "string", "minLength": 1 },
            { "type": "array", "minItems": 2, "items": { "type": "string", "minLength": 1 } }
          ]
        },
        "reason": { "type": "string", "minLength": 1 },
        "label": { "type": "string" },
        "description": { "type": "string" }
      },
      "allOf": [
        {
          "if": {
            "required": ["storage"],
            "properties": { "storage": { "const": "unstored" } }
          },
          "then": { "required": ["reason"] }
        }
      ]
    },
    "op": {
      "type": "object",
      "required": ["op"],
      "properties": {
        "op": { "type": "string" },
        "from": { "type": "string" },
        "as": { "type": "string" }
      }
    },
    "siteOverview": {
      "type": "object",
      "additionalProperties": false,
      "required": ["columns"],
      "properties": {
        "columns": { "type": "array", "items": { "type": "string" }, "minItems": 1 },
        "search": { "type": "array", "items": { "type": "string" } },
        "filters": { "type": "array", "items": { "$ref": "#/$defs/filter" } }
      }
    },
    "siteDetail": {
      "type": "object",
      "additionalProperties": false,
      "required": ["sections"],
      "properties": {
        "sections": {
          "type": "array",
          "items": { "$ref": "#/$defs/section" }
        }
      }
    },
    "filter": {
      "type": "object",
      "additionalProperties": false,
      "required": ["field", "kind"],
      "properties": {
        "field": { "type": "string" },
        "kind": { "enum": ["categorical", "range", "boolean"] }
      }
    },
    "section": {
      "oneOf": [
        {
          "type": "object",
          "additionalProperties": false,
          "required": ["id", "kind", "title", "fields"],
          "properties": {
            "id": { "type": "string" },
            "kind": { "const": "fieldList" },
            "title": { "type": "string" },
            "fields": { "type": "array", "items": { "type": "string" }, "minItems": 1 }
          }
        },
        {
          "type": "object",
          "additionalProperties": false,
          "required": ["id", "kind", "title", "renderer"],
          "properties": {
            "id": { "type": "string" },
            "kind": { "const": "custom" },
            "title": { "type": "string" },
            "renderer": { "type": "string" },
            "props": { "type": "object" }
          }
        }
      ]
    },
    "siteMap": {
      "type": "object",
      "additionalProperties": false,
      "required": ["layer", "renderKind"],
      "properties": {
        "layer": { "type": "string" },
        "renderKind": {
          "enum": [
            "point",
            "polygon",
            "point-or-polygon",
            "arc",
            "radius",
            "relation-overlay",
            "custom"
          ]
        },
        "icon": { "type": "string" },
        "color": {
          "type": "array",
          "items": { "type": "integer", "minimum": 0, "maximum": 255 },
          "minItems": 3,
          "maxItems": 4
        },
        "radius": { "type": "number", "minimum": 0 },
        "filters": { "type": "array", "items": { "$ref": "#/$defs/filter" } },
        "tooltip": { "type": "array", "items": { "type": "string" } },
        "legendLabel": { "type": "string", "minLength": 1 },
        "zOrder": { "type": "integer" }
      }
    }
  }
}
