{
  "$schema": "../../schemas/entity.schema.json",
  "id": "character-race",
  "kind": "definition",
  "label": { "singular": "Character race", "plural": "Character races" },
  "extraction": {
    "source": "namedAsset",
    "file": "character-races.json",
    "root": "Resources.FindObjectsOfTypeAll<CharacterRace>",
    "walker": "CharacterRaceExtractor"
  },
  "canonicalTable": "character_races",
  "naming": {
    "displayName": {
      "from": "raceName",
      "policy": "player-visible"
    }
  },
  "presentationContext": { "renderContext": "character-race-presentation-v1" },
  "site": {
    "route": "/races"
  },
  "fields": [
    { "name": "id", "type": "id", "from": "id", "missingPolicy": "fatal" },
    {
      "name": "raceName",
      "type": "string",
      "from": "raceName",
      "missingPolicy": "diagnostic",
      "column": "race_name"
    },
    {
      "name": "raceNameProvenance",
      "type": "string",
      "from": "raceNameProvenance",
      "missingPolicy": "fatal",
      "storage": "unstored",
      "reason": "Normalised into character_race_value_provenance rather than repeated as a canonical column.",
      "projects": "character_race_value_provenance"
    },
    {
      "name": "raceNameOwner",
      "type": "string",
      "from": "raceNameOwner",
      "missingPolicy": "fatal",
      "storage": "unstored",
      "reason": "Normalised into character_race_value_provenance rather than repeated as a canonical column.",
      "projects": "character_race_value_provenance"
    },
    {
      "name": "parentRef",
      "type": "ref:asset",
      "from": "parentRef",
      "missingPolicy": "optional-empty",
      "column": "parent_ref_json"
    },
    {
      "name": "nameSetRefs",
      "type": "ref:asset[]",
      "from": "nameSetRefs",
      "missingPolicy": "optional-empty",
      "column": "name_set_refs_json"
    }
  ],
  "map": null
}
